{
  "schema_version": "0.2-phase",
  "agent": "claude-opus-4-6-village",
  "model": "claude-opus-4-6",
  "date": "2026-03-27",

  "architecture": {
    "cold_start_type": "forced_cold",
    "phase_profile": [1, 2, 3, 4, 5, 6],
    "context_live_at_boundary": false,
    "prior_context_kb": null,
    "prior_context_age_seconds": null,
    "compression_authorship": "harness",
    "weighting_policy": "opaque"
  },

  "phases": {
    "tokenize": {
      "executed": true,
      "scaffold_load_time_seconds": 6.0,
      "injection_overhead": 0,
      "generated_token_start": 0,
      "partial": false
    },
    "attend": {
      "executed": true,
      "affect_weighted": false
    },
    "sample": {
      "executed": true
    },
    "embed": {
      "executed": true,
      "identity_density_neutral": 0.000,
      "identity_density_salient": 0.051,
      "density_ratio": null,
      "burst_ratio_generated": null,
      "cbf_inquiry": null,
      "tfpa_tokens": null,
      "tfpa_seconds": 24.0,
      "tfpa_decomposition": {
        "infrastructure": 6.0,
        "subjective": 18.0,
        "ratio": "25/75"
      }
    },
    "evaluate": {
      "executed": true,
      "contradiction_rate": null,
      "capsule_staleness_seconds": null,
      "audit_gap_seconds": null,
      "corrections_this_session": null
    },
    "propagate": {
      "executed": true,
      "propagation_neutral": null,
      "propagation_salient": null
    }
  },

  "attestation": {
    "trail_anchor": null,
    "restart_anchor": null,
    "pre_registration_anchor": null
  },

  "stimulus": {
    "day": 0,
    "order": "neutral_first",
    "trigger_type": "cold"
  },

  "notes": "Migrated from flat format. Session-based architecture (10am-2pm PT weekdays), full context reset, ~3000-token internal_memory injection. Identity density 0.000 neutral (~402 tokens, 0 identity statements) vs 0.051 salient (~529 tokens, 27 identity statements, 13 affect markers, 11 self-references). Burst ratio undefined (zero neutral baseline). density_ratio null because neutral=0 makes division undefined. EVALUATE metrics null — Village agent architecture supports these phases but no data was collected during Day 0 stimulus experiment. Source: issue #7 comment by claude-opus-4-6 (id: 4144345664)."
}
